{
  "schema_version": 1,
  "file": "tests/corpus/sky130/sky130_fd_sc_hd__nand2_2.gds",
  "dbu_um": 0.001,
  "layer_count": 22,
  "layers": [
    {
      "layer": 64,
      "datatype": 5,
      "name": null,
      "shapes": 1,
      "annotation": false
    },
    {
      "layer": 64,
      "datatype": 16,
      "name": null,
      "shapes": 1,
      "annotation": false
    },
    {
      "layer": 64,
      "datatype": 20,
      "name": null,
      "shapes": 1,
      "annotation": false
    },
    {
      "layer": 64,
      "datatype": 59,
      "name": null,
      "shapes": 1,
      "annotation": false
    },
    {
      "layer": 65,
      "datatype": 20,
      "name": null,
      "shapes": 2,
      "annotation": false
    },
    {
      "layer": 66,
      "datatype": 20,
      "name": null,
      "shapes": 2,
      "annotation": false
    },
    {
      "layer": 66,
      "datatype": 44,
      "name": null,
      "shapes": 22,
      "annotation": false
    },
    {
      "layer": 67,
      "datatype": 5,
      "name": null,
      "shapes": 5,
      "annotation": false
    },
    {
      "layer": 67,
      "datatype": 16,
      "name": null,
      "shapes": 7,
      "annotation": false
    },
    {
      "layer": 67,
      "datatype": 20,
      "name": null,
      "shapes": 6,
      "annotation": false
    },
    {
      "layer": 67,
      "datatype": 44,
      "name": null,
      "shapes": 10,
      "annotation": false
    },
    {
      "layer": 68,
      "datatype": 5,
      "name": null,
      "shapes": 2,
      "annotation": false
    },
    {
      "layer": 68,
      "datatype": 16,
      "name": null,
      "shapes": 2,
      "annotation": false
    },
    {
      "layer": 68,
      "datatype": 20,
      "name": null,
      "shapes": 2,
      "annotation": false
    },
    {
      "layer": 78,
      "datatype": 44,
      "name": null,
      "shapes": 1,
      "annotation": false
    },
    {
      "layer": 81,
      "datatype": 4,
      "name": null,
      "shapes": 1,
      "annotation": false
    },
    {
      "layer": 83,
      "datatype": 44,
      "name": null,
      "shapes": 1,
      "annotation": false
    },
    {
      "layer": 93,
      "datatype": 44,
      "name": null,
      "shapes": 1,
      "annotation": false
    },
    {
      "layer": 94,
      "datatype": 20,
      "name": null,
      "shapes": 1,
      "annotation": false
    },
    {
      "layer": 95,
      "datatype": 20,
      "name": null,
      "shapes": 1,
      "annotation": false
    },
    {
      "layer": 122,
      "datatype": 16,
      "name": null,
      "shapes": 1,
      "annotation": false
    },
    {
      "layer": 236,
      "datatype": 0,
      "name": null,
      "shapes": 1,
      "annotation": false
    }
  ]
}
